Guid,Description,DisplayUrl,ExternalId,Family,IsActive,Name,ProductCode,QuantityUnitOfMeasure,SBQQ__AssetAmendmentBehavior__c,SBQQ__AssetConversion__c,SBQQ__BatchQuantity__c,SBQQ__BillingFrequency__c,SBQQ__BillingType__c,SBQQ__BlockPricingField__c,SBQQ__ChargeType__c,SBQQ__Component__c,SBQQ__CompoundDiscountRate__c,SBQQ__ConfigurationEvent__c,SBQQ__ConfigurationFieldSet__c,SBQQ__ConfigurationFields__c,SBQQ__ConfigurationFormTitle__c,SBQQ__ConfigurationType__c,SBQQ__ConfigurationValidator__c,SBQQ__ConfiguredCodePattern__c,SBQQ__ConfiguredDescriptionPattern__c,SBQQ__CostEditable__c,SBQQ__CustomConfigurationPage__c,SBQQ__CustomConfigurationRequired__c,SBQQ__CustomerCommunityAvailability__c,SBQQ__DefaultPricingTable__c,SBQQ__DefaultQuantity__c,SBQQ__DescriptionLocked__c,SBQQ__DynamicPricingConstraint__c,SBQQ__EnableLargeConfiguration__c,SBQQ__ExcludeFromMaintenance__c,SBQQ__ExcludeFromOpportunity__c,SBQQ__ExternallyConfigurable__c,SBQQ__GenerateContractedPrice__c,SBQQ__HasConfigurationAttributes__c,SBQQ__HasConsumptionSchedule__c,SBQQ__Hidden__c,SBQQ__HidePriceInSearchResults__c,SBQQ__IncludeInMaintenance__c,SBQQ__NewQuoteGroup__c,SBQQ__NonDiscountable__c,SBQQ__NonPartnerDiscountable__c,SBQQ__OptionLayout__c,SBQQ__OptionSelectionMethod__c,SBQQ__Optional__c,SBQQ__PriceEditable__c,SBQQ__PricingMethodEditable__c,SBQQ__PricingMethod__c,SBQQ__ProductPictureID__c,SBQQ__QuantityEditable__c,SBQQ__QuantityScale__c,SBQQ__ReconfigurationDisabled__c,SBQQ__SortOrder__c,SBQQ__Specifications__c,SBQQ__SubscriptionBase__c,SBQQ__SubscriptionCategory__c,SBQQ__SubscriptionPercent__c,SBQQ__SubscriptionPricing__c,SBQQ__SubscriptionTerm__c,SBQQ__SubscriptionType__c,SBQQ__TaxCode__c,SBQQ__Taxable__c,SBQQ__TermDiscountLevel__c,SBQQ__UpgradeRatio__c,StockKeepingUnit
036126b5-e2a6-4624-b4b1-c1cae186b228,Universal Data Collection / Indexing combines high-end data collection with consumption based indexing and cloud machine learning analyzing real-time network data.,"#N/A","#N/A",Software,true,Universal Data Collection / Indexing,DC-008,"#N/A",Default,One per quote line,"#N/A",Monthly,Arrears,Quantity,Recurring,false,"#N/A","#N/A","#N/A","#N/A","#N/A","#N/A","#N/A","#N/A","#N/A",false,"#N/A",false,"#N/A","#N/A",1.0,false,"#N/A",false,false,false,false,"#N/A",false,true,false,false,false,false,true,false,"#N/A",Click,false,false,false,List,"#N/A",true,"#N/A",false,"#N/A","#N/A",List,"#N/A","#N/A",Fixed Price,1.0,Renewable,"#N/A",false,"#N/A","#N/A","#N/A"
03c7537e-4cca-4578-9510-fc5a39059aa8,"Occupying 1U of rack space, this shelf provides ventilation, 4-post mounting and an adjustable mounting depth.","#N/A","#N/A",Hardware,true,Fixed Shelf 250lbs,BSSA-4302,"#N/A",Allow Refund,One per quote line,"#N/A","#N/A","#N/A",Quantity,One-Time,true,"#N/A","#N/A","#N/A","#N/A","#N/A",Disabled,"#N/A","#N/A","#N/A",false,"#N/A",false,"#N/A","#N/A",1.0,false,"#N/A",false,false,false,false,"#N/A",false,false,false,false,true,false,false,false,Tabs,Click,false,false,false,List,"#N/A",true,"#N/A",false,"#N/A","#N/A",List,Hardware,"#N/A","#N/A","#N/A",One-time,"#N/A",false,"#N/A","#N/A","#N/A"
04b250ae-c0c9-4e94-8ae5-124a6988e361,Full control over User Experience for SSO Suite.,"#N/A","#N/A",Software,true,Customizable User Experience,S-SSO-UX,"#N/A",Default,One per quote line,"#N/A",Annual,Advance,Quantity,Recurring,false,"#N/A","#N/A","#N/A","#N/A","#N/A","#N/A","#N/A","#N/A","#N/A",false,"#N/A",false,"#N/A","#N/A",1.0,false,"#N/A",false,false,false,false,"#N/A",false,false,false,false,false,false,false,false,"#N/A",Click,false,false,false,List,"#N/A",true,"#N/A",false,"#N/A","#N/A",List,"#N/A","#N/A",Fixed Price,12.0,Renewable,"#N/A",false,"#N/A","#N/A","#N/A"
04c1e702-efb4-4e86-a294-6b1d396cf3af,"Global Threat Intelligence  (GTI) for Enterprise Security Manager delivers a constantly updated, rich feed that enables rapid discovery of events involving communications with suspicious or malicious IP addresses.","#N/A","#N/A",Software,true,Global Threat Intelligence for ESM,SIEM-007,"#N/A",Default,One per quote line,"#N/A",Annual,Arrears,Quantity,Recurring,false,"#N/A","#N/A","#N/A","#N/A","#N/A","#N/A","#N/A","#N/A","#N/A",false,"#N/A",false,"#N/A","#N/A",1.0,false,"#N/A",false,false,false,false,"#N/A",false,false,false,false,false,false,false,false,"#N/A",Click,false,false,false,List,"#N/A",true,"#N/A",false,"#N/A","#N/A",List,"#N/A","#N/A",Fixed Price,12.0,Renewable,"#N/A",false,"#N/A","#N/A","#N/A"
05dd73cd-f570-429b-a570-5f326a2e8f33,Basic Consulting package for implementation managed by 3rd party SI/Partner on Fixed Fee basis.,"#N/A","#N/A",Services,true,Quick Start Enablement,SV-QSE,"#N/A",Default,One per quote line,"#N/A","#N/A","#N/A",Quantity,One-Time,false,"#N/A","#N/A","#N/A","#N/A","#N/A","#N/A","#N/A","#N/A","#N/A",false,"#N/A",false,"#N/A","#N/A",1.0,false,"#N/A",false,false,false,false,"#N/A",false,false,false,false,false,false,true,false,"#N/A",Click,false,false,false,List,"#N/A",true,"#N/A",false,"#N/A","#N/A",List,"#N/A","#N/A","#N/A","#N/A",Renewable,"#N/A",false,"#N/A","#N/A","#N/A"
0721f299-8b60-4eca-b280-996ff703f3f7,VirusScan Enterprise for Storage ensures business continuity by protecting network-attached storage (NAS) devices against viruses and other malware.,"#N/A","#N/A",Software,true,VirusScan Enterprise for Storage,EP-015,"#N/A",Default,One per quote line,"#N/A",Monthly,Arrears,Quantity,Recurring,false,"#N/A","#N/A","#N/A","#N/A","#N/A","#N/A","#N/A","#N/A","#N/A",false,"#N/A",false,"#N/A",Standard,1.0,false,"#N/A",false,false,false,false,"#N/A",false,false,false,false,false,false,false,false,"#N/A",Click,false,false,false,List,"#N/A",true,"#N/A",false,"#N/A","#N/A",List,"#N/A","#N/A",Fixed Price,1.0,Renewable,"#N/A",false,"#N/A","#N/A","#N/A"
077af64e-9e43-4f81-a6b5-3ff9bde750f6,Network Security Specialist for Atomic Security Suite Deployments,"#N/A","#N/A",Services,true,Endpoint Security Specialist,SRVR-004,"#N/A",Default,"#N/A","#N/A","#N/A","#N/A",Quantity,One-Time,false,"#N/A","#N/A","#N/A","#N/A","#N/A","#N/A","#N/A","#N/A","#N/A",false,"#N/A",false,"#N/A","#N/A",1.0,false,"#N/A",false,false,false,false,"#N/A",false,false,false,false,false,false,false,false,"#N/A",Click,false,false,false,List,"#N/A",true,"#N/A",false,"#N/A","#N/A",List,"#N/A","#N/A","#N/A","#N/A",Renewable,"#N/A",false,"#N/A","#N/A","#N/A"
0a3c6e15-cdc7-4137-98bf-0aa3aec0e19f,"Intel Xeon E5-2698 v4 2.2GHz,50M Cache,9.60GT/s 20C/40T (135W) - Designed for software defined infrastructure supercharged for efficiency, performance, and agile services delivery across cloud-native and traditional applications.","#N/A","#N/A",Hardware,true,Intel Xeon E5-2698 v4 2.2GHz,INTEL E5-2698,"#N/A",Allow Refund,One per quote line,"#N/A","#N/A","#N/A",Quantity,One-Time,true,"#N/A","#N/A","#N/A","#N/A","#N/A",Disabled,"#N/A","#N/A","#N/A",false,"#N/A",false,"#N/A","#N/A",1.0,false,"#N/A",false,false,false,false,Do Not Generate,false,false,false,false,true,false,false,false,Tabs,Click,false,false,false,List,"#N/A",true,"#N/A",false,"#N/A","#N/A",List,Hardware,"#N/A","#N/A","#N/A",One-time,"#N/A",false,"#N/A","#N/A","#N/A"
0d735bd5-1065-4296-b622-9e2f0500aebc,Windows Server Datacenter edition is designed for organizations with large workloads and heavily virtualized server environments.,"#N/A","#N/A",Software,true,Windows Server Datacenter - Onetime License,WIN SDATA-OT,"#N/A",Allow Refund,One per quote line,"#N/A","#N/A","#N/A",Quantity,One-Time,true,"#N/A","#N/A","#N/A","#N/A","#N/A",Disabled,"#N/A","#N/A","#N/A",false,"#N/A",false,"#N/A","#N/A",1.0,false,"#N/A",false,false,false,false,"#N/A",false,false,false,false,true,false,false,false,Tabs,Click,false,false,false,List,"#N/A",true,"#N/A",false,"#N/A","#N/A",List,Software,"#N/A","#N/A","#N/A",Renewable,"#N/A",false,"#N/A","#N/A","#N/A"
16045f79-8ada-4da8-b222-4fb7116c9103,"Enterprise Security Manager is a security information and event management (SIEM) solution that delivers actionable intelligence and integrations to prioritize, investigate, and respond to threats. ***Evergreen - Billed Annually***","#N/A","#N/A",Software,true,Enterprise Security Manager (Evergreen),SIEMEG-005,"#N/A",Default,One per quote line,"#N/A",Annual,Advance,Quantity,Recurring,false,"#N/A","#N/A","#N/A","#N/A","#N/A","#N/A","#N/A","#N/A","#N/A",false,"#N/A",false,"#N/A","#N/A",1.0,false,"#N/A",false,false,false,false,"#N/A",false,false,false,false,false,false,false,false,"#N/A",Click,false,false,false,List,"#N/A",true,"#N/A",false,"#N/A","#N/A",List,"#N/A","#N/A",Fixed Price,12.0,Evergreen,"#N/A",false,"#N/A","#N/A","#N/A"
16659c88-c44b-4516-997e-4637ce8b4445,"System maintenance, administration, and configuration performed by a certified technician. Also includes 24x7 phone service and monthly on-site check-ups. 20% of hardware.","#N/A","#N/A",Services,true,Gold Hardware Maintenance,SUPP-1005,"#N/A",Default,One per quote line,"#N/A",Annual,Advance,Quantity,Recurring,true,"#N/A","#N/A","#N/A","#N/A","#N/A",Disabled,"#N/A","#N/A","#N/A",false,"#N/A",false,"#N/A","#N/A",1.0,false,"#N/A",false,false,false,false,"#N/A",false,false,false,false,false,false,true,false,Tabs,Click,false,false,false,List,"#N/A",true,"#N/A",false,"#N/A","#N/A",Net,Hardware,20.0,Percent Of Total,12.0,Renewable,"#N/A",false,"#N/A","#N/A","#N/A"
19523dfe-f05c-40ad-9282-46e58b32b887,Our certified Implementation Engineers bring a wealth of application expertise and integration experience to ensure the client's other systems are connected.,"#N/A","#N/A",Services,true,Implementation Engineer,SV-IMP,"#N/A",Default,One per quote line,"#N/A","#N/A","#N/A",Quantity,One-Time,true,"#N/A","#N/A","#N/A","#N/A","#N/A","#N/A","#N/A","#N/A","#N/A",false,"#N/A",false,"#N/A","#N/A",1.0,false,"#N/A",false,false,false,false,"#N/A",false,false,false,false,false,false,false,false,"#N/A",Click,false,false,false,List,"#N/A",true,"#N/A",false,"#N/A","#N/A",List,"#N/A","#N/A","#N/A","#N/A",Renewable,"#N/A",false,"#N/A","#N/A","#N/A"
1abdbdb3-0d84-40f6-a0d8-43e9e41faf77,Our certified Implementation Engineers bring a wealth of application expertise and integration experience to ensure the clients other systems are connected.,"#N/A","#N/A",Services,true,Implementation Engineer,SV-IMP,"#N/A",Default,One per quote line,"#N/A","#N/A","#N/A",Quantity,One-Time,false,"#N/A","#N/A","#N/A","#N/A","#N/A","#N/A","#N/A","#N/A","#N/A",false,"#N/A",false,"#N/A","#N/A",1.0,false,"#N/A",false,false,false,false,"#N/A",false,false,false,false,false,false,true,false,"#N/A",Click,false,false,false,List,"#N/A",true,"#N/A",false,"#N/A","#N/A",List,"#N/A","#N/A","#N/A","#N/A",Renewable,"#N/A",false,"#N/A","#N/A","#N/A"
1b023a36-2e74-4cc8-a366-7d647405a9ac,"8TB 7.2k RPM Self-Encrypting NLSAS 12Gps 3.5 in - Performing like any other hard drive, with the encryption being completely transparent or invisible to the user.","#N/A","#N/A",Hardware,true,8TB 7.2k RPM Self-Encrypting NLSAS,HD 8TBSE,"#N/A",Allow Refund,One per quote line,"#N/A","#N/A","#N/A",Quantity,One-Time,true,"#N/A","#N/A","#N/A","#N/A","#N/A",Disabled,"#N/A","#N/A","#N/A",false,"#N/A",false,"#N/A","#N/A",1.0,false,"#N/A",false,false,false,false,Do Not Generate,false,false,false,false,true,false,false,false,Tabs,Click,false,false,false,List,"#N/A",true,"#N/A",false,"#N/A","#N/A",List,Hardware,"#N/A","#N/A","#N/A",One-time,"#N/A",false,"#N/A","#N/A","#N/A"
1b1f8601-fdb9-4db3-8ea3-0df451dd1059,"8GB RDIMM, 2133MT/s, Dual Rank, x8 Data Width","#N/A","#N/A",Hardware,true,"8GB RDIMM, 2133MT/s",MEM 8GB,"#N/A",Allow Refund,One per quote line,"#N/A","#N/A","#N/A",Quantity,One-Time,true,"#N/A","#N/A","#N/A","#N/A","#N/A",Disabled,"#N/A","#N/A","#N/A",false,"#N/A",false,"#N/A","#N/A",1.0,false,"#N/A",false,false,false,false,Do Not Generate,false,false,false,false,true,false,false,false,Tabs,Click,false,false,false,List,"#N/A",true,"#N/A",false,"#N/A","#N/A",List,Hardware,"#N/A","#N/A","#N/A",One-time,"#N/A",false,"#N/A","#N/A","#N/A"
1c8c36eb-e40c-45eb-9eb5-ec3a863964b2,Online Admin Training for the Single Sign On Suite,"#N/A","#N/A",Services,true,SSO Admin Training,S-SSO-ADTR,"#N/A",Default,One per quote line,"#N/A","#N/A","#N/A",Quantity,One-Time,false,"#N/A","#N/A","#N/A","#N/A","#N/A","#N/A","#N/A","#N/A","#N/A",false,"#N/A",false,"#N/A","#N/A",1.0,false,"#N/A",false,false,false,false,"#N/A",false,false,false,false,false,false,false,false,"#N/A",Click,false,false,false,List,"#N/A",true,"#N/A",false,"#N/A","#N/A",List,"#N/A","#N/A","#N/A","#N/A",Renewable,"#N/A",false,"#N/A","#N/A","#N/A"
218eb637-7547-45bc-b9e9-5eaf1888f2ba,"#N/A","#N/A","#N/A",Software,true,Network Penetration Tests,SM-005,"#N/A",Default,One per quote line,"#N/A",Monthly,"#N/A",Quantity,Usage,false,"#N/A","#N/A","#N/A","#N/A","#N/A","#N/A","#N/A","#N/A","#N/A",false,"#N/A",false,"#N/A","#N/A",1.0,false,"#N/A",false,false,false,false,"#N/A",false,false,false,false,false,false,true,false,"#N/A",Click,false,false,false,List,"#N/A",true,"#N/A",false,"#N/A","#N/A","#N/A","#N/A","#N/A",Fixed Price,12.0,Renewable,"#N/A",false,"#N/A","#N/A","#N/A"
2265e06e-5a43-4584-97d1-0333d3bb9e08,Data Control Manager is a best in class data protection platform that includes asset management and control.,"#N/A","#N/A",Software,true,Data Control Manager (MDQ),DP-004,"#N/A",Default,One per quote line,"#N/A",Monthly,Arrears,Quantity,Recurring,false,"#N/A",Always,"#N/A","#N/A","#N/A",Required,"#N/A","#N/A","#N/A",false,"#N/A",false,"#N/A","#N/A",1.0,false,"#N/A",false,false,false,false,"#N/A",false,false,false,false,false,false,false,false,"#N/A",Click,false,false,false,List,"#N/A",true,"#N/A",false,"#N/A","#N/A",List,"#N/A","#N/A",Fixed Price,1.0,Renewable,"#N/A",false,"#N/A","#N/A","#N/A"
23d99aa6-0bad-4454-b5e7-ee285a19dac6,"#N/A","#N/A","#N/A",Software,true,ePolicy Orchestrator,SM-001,"#N/A",Default,One per quote line,"#N/A",Monthly,Advance,Quantity,Recurring,false,"#N/A","#N/A","#N/A","#N/A","#N/A","#N/A","#N/A","#N/A","#N/A",false,"#N/A",false,"#N/A","#N/A",1.0,false,"#N/A",false,false,false,false,"#N/A",false,false,false,false,false,false,false,false,"#N/A",Click,false,false,false,List,"#N/A",false,"#N/A",false,"#N/A","#N/A",List,"#N/A","#N/A",Fixed Price,12.0,Renewable,"#N/A",false,"#N/A","#N/A","#N/A"
245eb8c4-a6ed-4034-8441-dfcbd4fed0d1,"Rack PDU 20A, 120V L5-20 input 5-20 output - Basic Rack Power Distribution Unit allows users to distribute power outlets to rack-mount equipment.","#N/A","#N/A",Hardware,true,"Rack PDU 20A, 120V L5-20",PDU-2022,"#N/A",Allow Refund,One per quote line,"#N/A","#N/A","#N/A",Quantity,One-Time,true,"#N/A","#N/A","#N/A","#N/A","#N/A",Disabled,"#N/A","#N/A","#N/A",false,"#N/A",false,"#N/A","#N/A",1.0,false,"#N/A",false,false,false,false,"#N/A",false,false,false,false,true,false,false,false,Tabs,Click,false,false,false,List,"#N/A",true,"#N/A",false,"#N/A","#N/A",List,Hardware,"#N/A","#N/A","#N/A",One-time,"#N/A",false,"#N/A","#N/A","#N/A"
246a4754-49a6-48c2-b7b2-3c0d84ad358e,"Intel Xeon E5-2660 v4 2.0GHz,35M Cache,9.60GT/s QPI,Turbo,HT,14C/28T (105W) - Designed for software defined infrastructure supercharged for efficiency, performance, and agile services delivery across cloud-native and traditional applications.","#N/A","#N/A",Hardware,true,Intel Xeon E5-2660 v4 2.0GHz,INTEL E5-2660,"#N/A",Allow Refund,One per quote line,"#N/A","#N/A","#N/A",Quantity,One-Time,true,"#N/A","#N/A","#N/A","#N/A","#N/A",Disabled,"#N/A","#N/A","#N/A",false,"#N/A",false,"#N/A","#N/A",1.0,false,"#N/A",false,false,false,false,Do Not Generate,false,false,false,false,true,false,false,false,Tabs,Click,false,false,false,List,"#N/A",true,"#N/A",false,"#N/A","#N/A",List,Hardware,"#N/A","#N/A","#N/A",One-time,"#N/A",false,"#N/A","#N/A","#N/A"
269cc745-76b0-4005-aabd-3575fb4f0076,Data Loss Prevention (DLP) Endpoint helps to safeguard intellectual property and ensure compliance.,"#N/A","#N/A",Software,true,DLP Endpoint,DP-006,"#N/A",Default,One per quote line,"#N/A",Monthly,Arrears,Quantity,Recurring,false,"#N/A","#N/A","#N/A","#N/A","#N/A","#N/A","#N/A","#N/A","#N/A",false,"#N/A",false,"#N/A","#N/A",1.0,false,"#N/A",false,false,false,false,"#N/A",false,false,false,false,false,false,false,false,"#N/A",Click,false,false,false,List,"#N/A",true,"#N/A",false,"#N/A","#N/A",List,"#N/A","#N/A",Fixed Price,1.0,Renewable,"#N/A",false,"#N/A","#N/A","#N/A"
26ef940d-1d58-4c39-9f9d-26ebd7319cf5,"Enterprise Log Manager collects, compresses, signs, and stores all original events with a clear audit trail of activity that can't be repudiated.","#N/A","#N/A",Software,true,Enterprise Log Manager,SIEM-004,"#N/A",Default,One per quote line,"#N/A",Monthly,Arrears,Quantity,Recurring,false,"#N/A","#N/A","#N/A","#N/A","#N/A","#N/A","#N/A","#N/A","#N/A",false,"#N/A",false,"#N/A","#N/A",1.0,false,"#N/A",false,false,false,false,"#N/A",false,false,false,false,false,false,false,false,"#N/A",Click,false,false,false,List,"#N/A",true,"#N/A",false,"#N/A","#N/A",List,"#N/A","#N/A",Fixed Price,1.0,Renewable,"#N/A",false,"#N/A","#N/A","#N/A"
28105f9a-ce3d-441e-953b-d56f345a451f,"Intel Xeon E5-2603 v4 1.7GHz,15M Cache,6.4GT/s QPI,Turbo,HT 6C/6T (85W) - Designed for software defined infrastructure supercharged for efficiency, performance, and agile services delivery across cloud-native and traditional applications.","#N/A","#N/A",Hardware,true,Intel Xeon E5-2603 v4 1.7GHz,INTEL E5-2603,"#N/A",Allow Refund,One per quote line,"#N/A","#N/A","#N/A",Quantity,One-Time,true,"#N/A","#N/A","#N/A","#N/A","#N/A",Disabled,"#N/A","#N/A","#N/A",false,"#N/A",false,"#N/A","#N/A",1.0,false,"#N/A",false,false,false,false,Do Not Generate,false,false,false,false,false,false,false,false,Tabs,Click,false,false,false,List,"#N/A",true,"#N/A",false,"#N/A","#N/A",List,"#N/A","#N/A","#N/A","#N/A",One-time,"#N/A",false,"#N/A","#N/A","#N/A"
298a6303-b171-4534-9678-f530d1e1ec01,"Vulnerability Manager for Databases automatically discovers databases on your network, determines if the latest patches have been applied, and tests for common weaknesses.","#N/A","#N/A",Software,true,Vulnerability Manager for Databases,DBS-002,"#N/A",Default,One per quote line,"#N/A",Monthly,Arrears,Quantity,Recurring,false,"#N/A","#N/A","#N/A","#N/A","#N/A","#N/A","#N/A","#N/A","#N/A",false,"#N/A",false,"#N/A","#N/A",1.0,false,"#N/A",false,false,false,false,"#N/A",false,false,false,false,false,false,false,false,"#N/A",Click,false,false,false,List,"#N/A",true,"#N/A",false,"#N/A","#N/A",List,"#N/A","#N/A",Fixed Price,12.0,Renewable,"#N/A",false,"#N/A","#N/A","#N/A"
2ce00725-a96c-4345-8f44-77b0b409c39c,Project manager for Atomic Security Suite Deployments,"#N/A","#N/A",Services,true,Project Manager,SRVR-001,"#N/A",Default,"#N/A","#N/A","#N/A","#N/A",Quantity,One-Time,false,"#N/A","#N/A","#N/A","#N/A","#N/A","#N/A","#N/A","#N/A","#N/A",false,"#N/A",false,"#N/A","#N/A",1.0,false,"#N/A",false,false,false,false,"#N/A",false,false,false,false,false,false,false,false,"#N/A",Click,false,false,false,List,"#N/A",true,"#N/A",false,"#N/A","#N/A",List,"#N/A","#N/A","#N/A","#N/A",Renewable,"#N/A",false,"#N/A","#N/A","#N/A"
2d1a62ed-3161-4158-833a-f361fee85f04,"Support and protect your IT equipment with rack enclosures designed for flexible deployments, usability and infrastructure scalability.","#N/A","#N/A",Hardware,true,Maxspace Rack Enclosure,MAXS-1014,"#N/A",Allow Refund,One per quote line,"#N/A","#N/A","#N/A",Quantity,One-Time,false,"#N/A",Always,"#N/A","#N/A","#N/A",Required,"#N/A","#N/A","#N/A",false,"#N/A",false,"#N/A","#N/A",1.0,false,"#N/A",false,false,false,false,"#N/A",false,false,false,true,true,false,false,false,Tabs,Click,false,false,false,List,"#N/A",true,"#N/A",false,"#N/A","#N/A",List,Hardware,"#N/A","#N/A","#N/A",One-time,"#N/A",false,"#N/A","#N/A","#N/A"
2e12d4b5-9fd8-4cda-b0eb-8288d3d3eda7,Online Single Sign On Reporting training for end users includes education and certification modules. Annual Subscription.,"#N/A","#N/A",Services,true,SSO Reporting Training Portal for End Users,S-SSO-RTP,"#N/A",Default,One per quote line,"#N/A",Annual,Advance,Quantity,Recurring,false,"#N/A","#N/A","#N/A","#N/A","#N/A","#N/A","#N/A","#N/A","#N/A",false,"#N/A",false,"#N/A",Standard,1.0,false,"#N/A",false,false,false,false,"#N/A",false,false,false,false,false,false,false,false,"#N/A",Click,false,false,false,List,"#N/A",true,"#N/A",false,"#N/A","#N/A",List,"#N/A","#N/A",Fixed Price,12.0,Renewable,"#N/A",false,"#N/A","#N/A","#N/A"
2e3977fb-0412-47ca-8584-0fb8b7db89c4,On Premise Maintenance Fees,"#N/A","#N/A",Software,true,Maintenance,SSM-0001,"#N/A",Default,One per quote line,"#N/A",Monthly,Advance,Quantity,Recurring,false,"#N/A","#N/A","#N/A","#N/A","#N/A","#N/A","#N/A","#N/A","#N/A",false,"#N/A",false,"#N/A","#N/A",1.0,false,"#N/A",false,false,false,false,"#N/A",false,false,false,false,false,false,false,false,"#N/A",Click,false,false,false,List,"#N/A",false,"#N/A",false,"#N/A","#N/A",List,OnPremise,20.0,Percent Of Total,12.0,Renewable,"#N/A",false,"#N/A","#N/A","#N/A"
2ea3985c-1192-452b-aa0a-3fde68a05091,"vSphere Enterprise includes the full range of vSphere features for transforming datacenters into dramatically simplified cloud computing environments providing the next generation of flexible, reliable IT services.","#N/A","#N/A",Software,true,vSphere Enterprise,VMW-E,"#N/A",Allow Refund,One per quote line,"#N/A","#N/A","#N/A",Quantity,One-Time,true,"#N/A","#N/A","#N/A","#N/A","#N/A",Disabled,"#N/A","#N/A","#N/A",false,"#N/A",false,"#N/A","#N/A",1.0,false,"#N/A",false,false,false,false,"#N/A",false,false,false,false,true,false,false,false,Tabs,Click,false,false,false,List,"#N/A",true,"#N/A",false,"#N/A","#N/A",List,Software,"#N/A",Fixed Price,1.0,Renewable,"#N/A",false,"#N/A","#N/A","#N/A"
30eea536-2017-4992-99e1-61b9b803c694,Online Single Sign On training for end users includes education and certification modules. Annual Subscription.,"#N/A","#N/A",Services,true,SSO Training Portal for End Users,S-SSO-UTP,"#N/A",Default,One per quote line,"#N/A",Annual,Advance,Quantity,Recurring,false,"#N/A","#N/A","#N/A","#N/A","#N/A","#N/A","#N/A","#N/A","#N/A",false,"#N/A",false,"#N/A",Standard,1.0,false,"#N/A",false,false,false,false,"#N/A",false,false,false,false,false,false,false,false,"#N/A",Click,false,false,false,List,"#N/A",true,"#N/A",false,"#N/A","#N/A",List,"#N/A","#N/A",Fixed Price,12.0,Renewable,"#N/A",false,"#N/A","#N/A","#N/A"
31b2f3ec-c7d9-4582-9765-a7e4b99f028b,"Application Data Monitor detects fraud, data loss, and advanced threats by monitoring all the way to the application layer.","#N/A","#N/A",Software,true,Application Data Monitor,SIEM-002,"#N/A",Default,One per quote line,"#N/A",Annual,Arrears,Quantity,Recurring,false,"#N/A","#N/A","#N/A","#N/A","#N/A","#N/A","#N/A","#N/A","#N/A",false,"#N/A",false,"#N/A","#N/A",1.0,false,"#N/A",false,false,false,false,"#N/A",false,false,false,false,false,false,false,false,"#N/A",Click,false,false,false,List,"#N/A",true,"#N/A",false,"#N/A","#N/A",List,"#N/A","#N/A",Fixed Price,1.0,Renewable,"#N/A",false,"#N/A","#N/A","#N/A"
3202cd4a-b9fc-4d62-9e4d-958701cd8ead,4TB 7.2k RPM NLSAS 12Gps 3.5 in - Industry-leading rotational vibration tolerance design helps ensure consistent performance in dense multi-drive systems,"#N/A","#N/A",Hardware,true,4TB 7.2k RPM NLSAS,HD 4TB,"#N/A",Allow Refund,One per quote line,"#N/A","#N/A","#N/A",Quantity,One-Time,true,"#N/A","#N/A","#N/A","#N/A","#N/A",Disabled,"#N/A","#N/A","#N/A",false,"#N/A",false,"#N/A","#N/A",1.0,false,"#N/A",false,false,false,false,Do Not Generate,false,false,false,false,true,false,false,false,Tabs,Click,false,false,false,List,"#N/A",true,"#N/A",false,"#N/A","#N/A",List,Hardware,"#N/A","#N/A","#N/A",One-time,"#N/A",false,"#N/A","#N/A","#N/A"
320adb8f-aa3c-4727-b962-9f4e4738edba,"Rack PDU Metered 15A, 120V L5-20 input 5-20 output - Metered Rack Power Distribution Units (PDUs) provide active metering to enable energy optimization and circuit protection.","#N/A","#N/A",Hardware,true,"Rack PDU Metered 15A, 120V L5-20",MPDU-3006,"#N/A",Allow Refund,One per quote line,"#N/A","#N/A","#N/A",Quantity,One-Time,true,"#N/A","#N/A","#N/A","#N/A","#N/A",Disabled,"#N/A","#N/A","#N/A",false,"#N/A",false,"#N/A","#N/A",1.0,false,"#N/A",false,false,false,false,"#N/A",false,false,false,false,false,false,false,false,Tabs,Click,false,false,false,List,"#N/A",true,"#N/A",false,"#N/A","#N/A",List,"#N/A","#N/A","#N/A","#N/A",One-time,"#N/A",false,"#N/A","#N/A","#N/A"
328aa860-fc2d-4948-9ab6-8e60a5efa4e7,"Application Control blocks unauthorized executables on servers, corporate desktops, and fixed-function devices.","#N/A","#N/A",Software,true,Application Control,AC-001,"#N/A",Default,One per quote line,"#N/A",Monthly,Arrears,Quantity,Recurring,false,"#N/A","#N/A","#N/A","#N/A","#N/A","#N/A","#N/A","#N/A","#N/A",false,"#N/A",false,"#N/A","#N/A",1.0,false,"#N/A",false,false,false,false,"#N/A",false,false,false,false,false,false,false,false,"#N/A",Click,false,false,false,List,"#N/A",true,"#N/A",false,"#N/A","#N/A",List,"#N/A","#N/A",Fixed Price,1.0,Renewable,"#N/A",false,"#N/A","#N/A","#N/A"
33d8c4fd-c7ee-4abc-890a-5e6cd527b3b8,"Intel E5-2650 v4 2.2GHz,30M Cache,9.60GT/s QPI,Turbo,HT,12C/24T (105W) - Designed for software defined infrastructure supercharged for efficiency, performance, and agile services delivery across cloud-native and traditional applications.","#N/A","#N/A",Hardware,true,Intel E5-2650 v4 2.2GHz,INTEL E5-2650,"#N/A",Allow Refund,One per quote line,"#N/A","#N/A","#N/A",Quantity,One-Time,true,"#N/A","#N/A","#N/A","#N/A","#N/A",Disabled,"#N/A","#N/A","#N/A",false,"#N/A",false,"#N/A","#N/A",1.0,false,"#N/A",false,false,false,false,Do Not Generate,false,false,false,false,false,false,false,false,Tabs,Click,false,false,false,List,"#N/A",true,"#N/A",false,"#N/A","#N/A",List,"#N/A","#N/A","#N/A","#N/A",One-time,"#N/A",false,"#N/A","#N/A","#N/A"
