Guid,Description,DisplayUrl,ExternalId,Family,IsActive,Name,ProductCode,QuantityUnitOfMeasure,SBQQ__AssetAmendmentBehavior__c,SBQQ__AssetConversion__c,SBQQ__BatchQuantity__c,SBQQ__BillingFrequency__c,SBQQ__BillingType__c,SBQQ__BlockPricingField__c,SBQQ__ChargeType__c,SBQQ__Component__c,SBQQ__CompoundDiscountRate__c,SBQQ__ConfigurationEvent__c,SBQQ__ConfigurationFieldSet__c,SBQQ__ConfigurationFields__c,SBQQ__ConfigurationFormTitle__c,SBQQ__ConfigurationType__c,SBQQ__ConfigurationValidator__c,SBQQ__ConfiguredCodePattern__c,SBQQ__ConfiguredDescriptionPattern__c,SBQQ__CostEditable__c,SBQQ__CustomConfigurationPage__c,SBQQ__CustomConfigurationRequired__c,SBQQ__CustomerCommunityAvailability__c,SBQQ__DefaultPricingTable__c,SBQQ__DefaultQuantity__c,SBQQ__DescriptionLocked__c,SBQQ__DynamicPricingConstraint__c,SBQQ__EnableLargeConfiguration__c,SBQQ__ExcludeFromMaintenance__c,SBQQ__ExcludeFromOpportunity__c,SBQQ__ExternallyConfigurable__c,SBQQ__GenerateContractedPrice__c,SBQQ__HasConfigurationAttributes__c,SBQQ__HasConsumptionSchedule__c,SBQQ__Hidden__c,SBQQ__HidePriceInSearchResults__c,SBQQ__IncludeInMaintenance__c,SBQQ__NewQuoteGroup__c,SBQQ__NonDiscountable__c,SBQQ__NonPartnerDiscountable__c,SBQQ__OptionLayout__c,SBQQ__OptionSelectionMethod__c,SBQQ__Optional__c,SBQQ__PriceEditable__c,SBQQ__PricingMethodEditable__c,SBQQ__PricingMethod__c,SBQQ__ProductPictureID__c,SBQQ__QuantityEditable__c,SBQQ__QuantityScale__c,SBQQ__ReconfigurationDisabled__c,SBQQ__SortOrder__c,SBQQ__Specifications__c,SBQQ__SubscriptionBase__c,SBQQ__SubscriptionCategory__c,SBQQ__SubscriptionPercent__c,SBQQ__SubscriptionPricing__c,SBQQ__SubscriptionTerm__c,SBQQ__SubscriptionType__c,SBQQ__TaxCode__c,SBQQ__Taxable__c,SBQQ__TermDiscountLevel__c,SBQQ__UpgradeRatio__c,StockKeepingUnit
0175aa8d-2feb-459b-87ec-e507282cee93,"MaxShell cooling, power distribution, and cable management products work seamlessly with IT enclosures to provide a complete infrastructure support system.  Holds 10 rack units (U's) for a vertical storage rack.","#N/A","#N/A",Hardware,true,MaxShell 10U 600mmx1200mm,BMX-1053,"#N/A",Allow Refund,One per quote line,"#N/A","#N/A","#N/A",Quantity,One-Time,true,"#N/A","#N/A","#N/A","#N/A","#N/A",Disabled,"#N/A","#N/A","#N/A",false,"#N/A",false,"#N/A","#N/A",1.0,false,"#N/A",false,false,false,false,"#N/A",false,false,false,false,true,false,false,false,Tabs,Click,false,false,false,List,"#N/A",true,"#N/A",false,"#N/A","#N/A",List,Hardware,"#N/A","#N/A","#N/A",One-time,"#N/A",false,"#N/A","#N/A","#N/A"
0465edb5-f64a-4156-bf3c-fd74cf52a59d,"Enterprise Log Manager collects, compresses, signs, and stores all original events with a clear audit trail of activity that can't be repudiated. ***Renewable/Evergreen - Billed Monthly***","#N/A","#N/A",Software,true,Enterprise Log Manager (Evergreen),SIEMEG-004,"#N/A",Default,One per quote line,"#N/A",Monthly,Advance,Quantity,Recurring,false,"#N/A","#N/A","#N/A","#N/A","#N/A","#N/A","#N/A","#N/A","#N/A",false,"#N/A",false,"#N/A","#N/A",1.0,false,"#N/A",false,false,false,false,"#N/A",false,false,false,false,false,false,false,false,"#N/A",Click,false,false,false,List,"#N/A",true,"#N/A",false,"#N/A","#N/A",List,"#N/A","#N/A",Fixed Price,1.0,Renewable/Evergreen,"#N/A",false,"#N/A","#N/A","#N/A"
0739c2ed-2f42-4a22-b0d9-0fbfd73a5f86,"The Project Manager ensures a projects timely and efficient delivery by coordinating meetings, tracking progress, escalating issues, and proctoring weekly status reports.","#N/A","#N/A",Services,true,Project Manager,SV-PMN,"#N/A",Default,One per quote line,"#N/A","#N/A","#N/A",Quantity,One-Time,false,"#N/A","#N/A","#N/A","#N/A","#N/A","#N/A","#N/A","#N/A","#N/A",false,"#N/A",false,"#N/A","#N/A",1.0,false,"#N/A",false,false,false,false,"#N/A",false,false,false,false,false,false,true,false,"#N/A",Click,false,false,false,List,"#N/A",true,"#N/A",false,"#N/A","#N/A",List,"#N/A","#N/A","#N/A","#N/A",Renewable,"#N/A",false,"#N/A","#N/A","#N/A"
08df428f-0d39-48ed-be3c-061e77063031,"Data Loss Prevention (DLP) Discover helps find and remediate sensitive data that resides on your servers, network shares, databases, and in the cloud.","#N/A","#N/A",Software,true,DLP Discover,DP-005,"#N/A",Default,One per quote line,"#N/A",Monthly,Arrears,Quantity,Recurring,false,"#N/A","#N/A","#N/A","#N/A","#N/A","#N/A","#N/A","#N/A","#N/A",false,"#N/A",false,"#N/A","#N/A",1.0,false,"#N/A",false,false,false,false,"#N/A",false,false,false,false,false,false,false,false,"#N/A",Click,false,false,false,List,"#N/A",true,"#N/A",false,"#N/A","#N/A",List,"#N/A","#N/A",Fixed Price,1.0,Renewable,"#N/A",false,"#N/A","#N/A","#N/A"
0e435a00-8d21-4bf9-b4b1-b752950a8fa5,"8 Hour Support SLA. Online support forums, community help documentation. Email and Online Support Tickets. Phone support during NA business hours.","#N/A","#N/A",Services,true,Gold Support,SPT-002,"#N/A",Default,"#N/A","#N/A","#N/A","#N/A",Quantity,One-Time,false,"#N/A","#N/A","#N/A","#N/A","#N/A","#N/A","#N/A","#N/A","#N/A",false,"#N/A",false,"#N/A","#N/A",1.0,false,"#N/A",false,false,false,false,"#N/A",false,false,false,false,false,false,true,false,"#N/A",Click,false,false,false,List,"#N/A",false,"#N/A",false,"#N/A","#N/A",List,"#N/A","#N/A",Fixed Price,12.0,Renewable,"#N/A",false,"#N/A","#N/A","#N/A"
10bb0a48-8c03-4fc4-871f-68f5c4bc7315,vSphere Standard provides an entry solution for basic consolidation of applications to slash hardware costs while accelerating application deployment.,"#N/A","#N/A",Software,true,vSphere Standard,VMW-S,"#N/A",Allow Refund,One per quote line,"#N/A","#N/A","#N/A",Quantity,One-Time,true,"#N/A","#N/A","#N/A","#N/A","#N/A",Disabled,"#N/A","#N/A","#N/A",false,"#N/A",false,"#N/A","#N/A",1.0,false,"#N/A",false,false,false,false,"#N/A",false,false,false,false,true,false,false,false,Tabs,Click,false,false,false,List,"#N/A",true,"#N/A",false,"#N/A","#N/A",List,Software,"#N/A",Fixed Price,1.0,Renewable,"#N/A",false,"#N/A","#N/A","#N/A"
114d64d0-33d6-4825-82df-dee845848bcc,"Intel E5-2650 v4 2.2GHz,30M Cache,9.60GT/s QPI,Turbo,HT,12C/24T (105W) - Designed for software defined infrastructure supercharged for efficiency, performance, and agile services delivery across cloud-native and traditional applications.","#N/A","#N/A",Hardware,true,Intel E5-2650 v4 2.2GHz,INTEL E5-2650,"#N/A",Allow Refund,One per quote line,"#N/A","#N/A","#N/A",Quantity,One-Time,true,"#N/A","#N/A","#N/A","#N/A","#N/A",Disabled,"#N/A","#N/A","#N/A",false,"#N/A",false,"#N/A","#N/A",1.0,false,"#N/A",false,false,false,false,Do Not Generate,false,false,false,false,false,false,false,false,Tabs,Click,false,false,false,List,"#N/A",true,"#N/A",false,"#N/A","#N/A",List,"#N/A","#N/A","#N/A","#N/A",One-time,"#N/A",false,"#N/A","#N/A","#N/A"
12102a1d-630b-4337-bb01-682b02bf8fe4,"vSphere Desktop can be used to power virtual desktops, as well as the underlying infrastructure for the VDI environment.","#N/A","#N/A",Software,true,vSphere Desktop,VMW-D,"#N/A",Allow Refund,One per quote line,"#N/A","#N/A","#N/A",Quantity,One-Time,true,"#N/A","#N/A","#N/A","#N/A","#N/A",Disabled,"#N/A","#N/A","#N/A",false,"#N/A",false,"#N/A","#N/A",1.0,false,"#N/A",false,false,false,false,"#N/A",false,false,false,false,true,false,false,false,Tabs,Click,false,false,false,List,"#N/A",true,"#N/A",false,"#N/A","#N/A",List,Software,"#N/A",Fixed Price,1.0,Renewable,"#N/A",false,"#N/A","#N/A","#N/A"
12fb901c-8e99-4db5-962c-fa5ab1c0fb51,Universal Data Collection / Indexing combines high-end data collection with consumption based indexing and cloud machine learning analyzing real-time network data.,"#N/A","#N/A",Software,true,Universal Data Collection / Indexing,DC-008,"#N/A",Default,One per quote line,"#N/A",Monthly,Arrears,Quantity,Recurring,false,"#N/A","#N/A","#N/A","#N/A","#N/A","#N/A","#N/A","#N/A","#N/A",false,"#N/A",false,"#N/A","#N/A",1.0,false,"#N/A",false,false,false,false,"#N/A",false,true,false,false,false,false,true,false,"#N/A",Click,false,false,false,List,"#N/A",true,"#N/A",false,"#N/A","#N/A",List,"#N/A","#N/A",Fixed Price,1.0,Renewable,"#N/A",false,"#N/A","#N/A","#N/A"
130824f6-1ccf-42d4-aded-f679d70cd84d,"Rack PDU 14.4kW, 208V, 3 phase CS8365 input C13 output - Basic Rack Power Distribution Unit allows users to distribute power outlets to rack-mount equipment.","#N/A","#N/A",Hardware,true,"Rack PDU 14.4kW, 208V, C13 output",PDU-2028,"#N/A",Allow Refund,One per quote line,"#N/A","#N/A","#N/A",Quantity,One-Time,true,"#N/A","#N/A","#N/A","#N/A","#N/A",Disabled,"#N/A","#N/A","#N/A",false,"#N/A",false,"#N/A","#N/A",1.0,false,"#N/A",false,false,false,false,"#N/A",false,false,false,false,true,false,false,false,Tabs,Click,false,false,false,List,"#N/A",true,"#N/A",false,"#N/A","#N/A",List,Hardware,"#N/A","#N/A","#N/A",One-time,"#N/A",false,"#N/A","#N/A","#N/A"
13c886bb-c4a5-4c4d-a719-47909746be5d,The Power Cord is designed to provide ideal electrical connectivity to your equipments. It operates at 250-Volt voltage range.,"#N/A","#N/A",Hardware,true,C13 to C14 Power Cable 5',CMPC-5888,"#N/A",Allow Refund,One per quote line,"#N/A","#N/A","#N/A",Quantity,One-Time,true,"#N/A","#N/A","#N/A","#N/A","#N/A",Disabled,"#N/A","#N/A","#N/A",false,"#N/A",false,"#N/A","#N/A",1.0,false,"#N/A",false,false,false,false,"#N/A",false,false,false,false,true,false,false,false,Tabs,Click,false,false,false,List,"#N/A",true,"#N/A",false,"#N/A","#N/A",List,Hardware,"#N/A","#N/A","#N/A",One-time,"#N/A",false,"#N/A","#N/A","#N/A"
13da75d6-fa67-4256-9827-fe2a6da3dfc5,Module providing Application Protection for tech stack. Blocks of 5 applications.,"#N/A","#N/A",Software,true,Application Protection Block,S-SSO-APB,"#N/A",Default,One per quote line,"#N/A",Annual,Advance,Quantity,Recurring,false,"#N/A",Always,"#N/A","#N/A","#N/A",Disabled,"#N/A","#N/A","#N/A",false,"#N/A",false,"#N/A","#N/A",1.0,false,"#N/A",false,false,false,false,"#N/A",false,false,false,false,false,false,false,false,"#N/A",Click,false,false,false,Block,"#N/A",true,"#N/A",false,"#N/A","#N/A",List,"#N/A","#N/A",Fixed Price,12.0,Renewable,"#N/A",false,"#N/A","#N/A","#N/A"
13e21b0f-100a-4821-ae47-eb91f89454e6,"Data Loss Prevention (DLP) Monitor allows you to gather, track, and report on the data in motion across your entire network.","#N/A","#N/A",Software,true,DLP Monitor,DP-007,"#N/A",Default,One per quote line,"#N/A",Monthly,Arrears,Quantity,Recurring,false,"#N/A","#N/A","#N/A","#N/A","#N/A","#N/A","#N/A","#N/A","#N/A",false,"#N/A",false,"#N/A","#N/A",1.0,false,"#N/A",false,false,false,false,"#N/A",false,false,false,false,false,false,false,false,"#N/A",Click,false,false,false,List,"#N/A",true,"#N/A",false,"#N/A","#N/A",List,"#N/A","#N/A",Fixed Price,1.0,Renewable,"#N/A",false,"#N/A","#N/A","#N/A"
14615f1b-2974-4871-bb1a-06fc24eeb347,"8TB 7.2k RPM Self-Encrypting NLSAS 12Gps 3.5 in - Performing like any other hard drive, with the encryption being completely transparent or invisible to the user.","#N/A","#N/A",Hardware,true,8TB 7.2k RPM Self-Encrypting NLSAS,HD 8TBSE,"#N/A",Allow Refund,One per quote line,"#N/A","#N/A","#N/A",Quantity,One-Time,true,"#N/A","#N/A","#N/A","#N/A","#N/A",Disabled,"#N/A","#N/A","#N/A",false,"#N/A",false,"#N/A","#N/A",1.0,false,"#N/A",false,false,false,false,Do Not Generate,false,false,false,false,true,false,false,false,Tabs,Click,false,false,false,List,"#N/A",true,"#N/A",false,"#N/A","#N/A",List,Hardware,"#N/A","#N/A","#N/A",One-time,"#N/A",false,"#N/A","#N/A","#N/A"
155e6727-5dcf-4235-b452-59ba48fa0431,"Occupying 1U of rack space, this sliding shelf provides ventilation, and easy access to severs.","#N/A","#N/A",Hardware,true,Sliding Shelf 200lbs,BSSA-4300,"#N/A",Allow Refund,One per quote line,"#N/A","#N/A","#N/A",Quantity,One-Time,true,"#N/A","#N/A","#N/A","#N/A","#N/A",Disabled,"#N/A","#N/A","#N/A",false,"#N/A",false,"#N/A","#N/A",1.0,false,"#N/A",false,false,false,false,"#N/A",false,false,false,false,true,false,false,false,Tabs,Click,false,false,false,List,"#N/A",true,"#N/A",false,"#N/A","#N/A",List,Hardware,"#N/A","#N/A","#N/A",One-time,"#N/A",false,"#N/A","#N/A","#N/A"
160e236a-5546-4a70-887f-ce582a401cab,"#N/A","#N/A","#N/A",Services,true,Quick Deploy,SRV-001,"#N/A",Default,"#N/A","#N/A",Invoice Plan,Advance,Quantity,Recurring,false,"#N/A","#N/A","#N/A","#N/A","#N/A","#N/A","#N/A","#N/A","#N/A",false,"#N/A",false,"#N/A","#N/A",1.0,false,"#N/A",false,false,false,false,"#N/A",false,false,false,false,false,false,true,false,"#N/A",Click,false,false,false,List,"#N/A",true,"#N/A",false,"#N/A","#N/A",List,"#N/A","#N/A","#N/A","#N/A",Renewable,"#N/A",false,"#N/A","#N/A","#N/A"
176fabe3-e14b-4923-b947-83ca9ce0ad09,"Mounting hardware includes light and heavy-duty shelves, bolt-down brackets, stabilization plates, grounding kits, keyboard drawers, mounting rails, brackets, and associated hardware.","#N/A","#N/A",Hardware,true,TX 600mm/750mm Stabalizer Plate,BSSA-4303,"#N/A",Allow Refund,One per quote line,"#N/A","#N/A","#N/A",Quantity,One-Time,true,"#N/A","#N/A","#N/A","#N/A","#N/A",Disabled,"#N/A","#N/A","#N/A",false,"#N/A",false,"#N/A","#N/A",1.0,false,"#N/A",false,false,false,false,"#N/A",false,false,false,false,true,false,false,false,Tabs,Click,false,false,false,List,"#N/A",true,"#N/A",false,"#N/A","#N/A",List,Hardware,"#N/A","#N/A","#N/A",One-time,"#N/A",false,"#N/A","#N/A","#N/A"
1abac39e-f331-4aa1-93e1-2bab422e4d3d,"Rack PDU Metered 15A, 120V L5-20 input 5-20 output - Metered Rack Power Distribution Units (PDUs) provide active metering to enable energy optimization and circuit protection.","#N/A","#N/A",Hardware,true,"Rack PDU Metered 15A, 120V L5-20",MPDU-3006,"#N/A",Allow Refund,One per quote line,"#N/A","#N/A","#N/A",Quantity,One-Time,true,"#N/A","#N/A","#N/A","#N/A","#N/A",Disabled,"#N/A","#N/A","#N/A",false,"#N/A",false,"#N/A","#N/A",1.0,false,"#N/A",false,false,false,false,"#N/A",false,false,false,false,false,false,false,false,Tabs,Click,false,false,false,List,"#N/A",true,"#N/A",false,"#N/A","#N/A",List,"#N/A","#N/A","#N/A","#N/A",One-time,"#N/A",false,"#N/A","#N/A","#N/A"
20e12251-555e-406a-a029-7d02635ec566,Network Security Specialist for Atomic Security Suite Deployments,"#N/A","#N/A",Services,true,Network Security Specialist,SRVR-003,"#N/A",Default,"#N/A","#N/A","#N/A","#N/A",Quantity,One-Time,false,"#N/A","#N/A","#N/A","#N/A","#N/A","#N/A","#N/A","#N/A","#N/A",false,"#N/A",false,"#N/A","#N/A",1.0,false,"#N/A",false,false,false,false,"#N/A",false,false,false,false,false,false,false,false,"#N/A",Click,false,false,false,List,"#N/A",true,"#N/A",false,"#N/A","#N/A",List,"#N/A","#N/A","#N/A","#N/A",Renewable,"#N/A",false,"#N/A","#N/A","#N/A"
22bb1631-6192-4893-9ce4-7100086f7bd4,"The PowerSlide server is designed to bring excellent performance, expandability and deployment flexibility to organizations that must deploy multiple integrated servers in a minimum amount of space at a low cost.","#N/A","#N/A",Hardware,true,PowerSlide R750 Rack Server,PS-R750,"#N/A",Allow Refund,One per quote line,"#N/A","#N/A","#N/A",Quantity,One-Time,false,"#N/A",Always,"#N/A","#N/A","#N/A",Allowed,"#N/A",PS-R-{1}{2}{3}{4},"#N/A",false,"#N/A",false,"#N/A","#N/A",1.0,false,"#N/A",false,false,false,false,"#N/A",true,false,false,false,true,false,false,false,Tabs,Click,false,false,false,List,"#N/A",true,"#N/A",false,"#N/A","#N/A",List,Hardware,"#N/A","#N/A","#N/A",One-time,"#N/A",false,"#N/A","#N/A","#N/A"
231e1228-8455-464b-86a0-d22073fb2962,"Web Gateway Cloud Service eliminates the constraints of on-network web security by connecting users from any device or location to the internet through our cloud, maintaining protection wherever they go.","#N/A","#N/A",Software,true,Web Gateway Cloud Service,WS-002,"#N/A",Default,One per quote line,"#N/A",Monthly,Arrears,Quantity,Recurring,false,"#N/A","#N/A","#N/A","#N/A","#N/A","#N/A","#N/A","#N/A","#N/A",false,"#N/A",false,"#N/A","#N/A",1.0,false,"#N/A",false,false,false,false,"#N/A",false,false,false,false,false,false,false,false,"#N/A",Click,false,false,false,List,"#N/A",true,"#N/A",false,"#N/A","#N/A",List,"#N/A","#N/A",Fixed Price,1.0,Renewable,"#N/A",false,"#N/A","#N/A","#N/A"
233b5411-0493-4749-8811-934e364a9a28,"8GB RDIMM, 2133MT/s, Dual Rank, x8 Data Width","#N/A","#N/A",Hardware,true,"8GB RDIMM, 2133MT/s",MEM 8GB,"#N/A",Allow Refund,One per quote line,"#N/A","#N/A","#N/A",Quantity,One-Time,true,"#N/A","#N/A","#N/A","#N/A","#N/A",Disabled,"#N/A","#N/A","#N/A",false,"#N/A",false,"#N/A","#N/A",1.0,false,"#N/A",false,false,false,false,Do Not Generate,false,false,false,false,true,false,false,false,Tabs,Click,false,false,false,List,"#N/A",true,"#N/A",false,"#N/A","#N/A",List,Hardware,"#N/A","#N/A","#N/A",One-time,"#N/A",false,"#N/A","#N/A","#N/A"
23908226-353a-45f2-b101-afac21542db7,"Web Protection uses secure web gateway technology to protect every device, user, and location from sophisticated internet threats.","#N/A","#N/A",Software,true,Web Protection,WS-003,"#N/A",Default,One per quote line,"#N/A",Monthly,Arrears,Quantity,Recurring,false,"#N/A","#N/A","#N/A","#N/A","#N/A","#N/A","#N/A","#N/A","#N/A",false,"#N/A",false,"#N/A","#N/A",1.0,false,"#N/A",false,false,false,false,"#N/A",false,false,false,false,false,false,false,false,"#N/A",Click,false,false,false,List,"#N/A",true,"#N/A",false,"#N/A","#N/A",List,"#N/A","#N/A",Fixed Price,1.0,Renewable,"#N/A",false,"#N/A","#N/A","#N/A"
2632775d-5822-421a-9901-2e255ab192ea,Data Control Manager is a best in class data protection platform that includes asset management and control.,"#N/A","#N/A",Software,true,Data Control Manager (MDQ),DP-004,"#N/A",Default,One per quote line,"#N/A",Monthly,Arrears,Quantity,Recurring,false,"#N/A",Always,"#N/A","#N/A","#N/A",Required,"#N/A","#N/A","#N/A",false,"#N/A",false,"#N/A","#N/A",1.0,false,"#N/A",false,false,false,false,"#N/A",false,false,false,false,false,false,false,false,"#N/A",Click,false,false,false,List,"#N/A",true,"#N/A",false,"#N/A","#N/A",List,"#N/A","#N/A",Fixed Price,1.0,Renewable,"#N/A",false,"#N/A","#N/A","#N/A"
27dbe881-797f-4903-88f7-68fa4aa63762,Public Cloud Server Security Suite provides instant discovery and control across Amazon Web Services (AWS) and Microsoft Azure cloud workloads.,"#N/A","#N/A",Software,true,Public Cloud Server Security Suite,SS-007,"#N/A",Default,One per quote line,"#N/A",Monthly,Arrears,Quantity,Recurring,false,"#N/A","#N/A","#N/A","#N/A","#N/A","#N/A","#N/A","#N/A","#N/A",false,"#N/A",false,"#N/A","#N/A",1.0,false,"#N/A",false,false,false,false,"#N/A",false,false,false,false,false,false,false,false,"#N/A",Click,false,false,false,List,"#N/A",true,"#N/A",false,"#N/A","#N/A",List,OnPremise,"#N/A",Fixed Price,1.0,"#N/A","#N/A",false,"#N/A","#N/A","#N/A"
28b8e28d-ad79-4ddc-9ceb-f5fa11be30d5,"1 Hour Support SLA. Online support forums, community help documentation. Email and Online Support Tickets. Follow the sun phone support 24/7","#N/A","#N/A",Services,true,Platinum Support,SPT-003,"#N/A",Default,"#N/A","#N/A","#N/A","#N/A",Quantity,One-Time,false,"#N/A","#N/A","#N/A","#N/A","#N/A","#N/A","#N/A","#N/A","#N/A",false,"#N/A",false,"#N/A","#N/A",1.0,false,"#N/A",false,false,false,false,"#N/A",false,false,false,false,false,false,true,false,"#N/A",Click,false,false,false,List,"#N/A",false,"#N/A",false,"#N/A","#N/A",List,"#N/A","#N/A",Fixed Price,12.0,Renewable,"#N/A",false,"#N/A","#N/A","#N/A"
2b8ce9db-31cb-4bd4-9bed-42a4eda2f04d,SLA Credit,"#N/A","#N/A","#N/A",true,SLA Credit,sla-credit,"#N/A",Default,One per quote line,"#N/A","#N/A","#N/A",Quantity,One-Time,true,"#N/A","#N/A","#N/A","#N/A","#N/A","#N/A","#N/A","#N/A","#N/A",false,"#N/A",false,"#N/A","#N/A",1.0,false,"#N/A",false,false,false,false,"#N/A",false,false,false,false,false,false,false,false,"#N/A",Click,false,true,false,List,"#N/A",true,"#N/A",false,"#N/A","#N/A",List,"#N/A","#N/A","#N/A","#N/A",Renewable,"#N/A",false,"#N/A","#N/A","#N/A"
2be6934c-2889-496f-ab43-278be5024ef0,"32GB RDIMM, 2133 MT/s, Low Volt, Dual Rank, x4 Data Width","#N/A","#N/A",Hardware,true,"32GB RDIMM, 2133MT/s",MEM 32GB,"#N/A",Allow Refund,One per quote line,"#N/A","#N/A","#N/A",Quantity,One-Time,true,"#N/A","#N/A","#N/A","#N/A","#N/A",Disabled,"#N/A","#N/A","#N/A",false,"#N/A",false,"#N/A","#N/A",1.0,false,"#N/A",false,false,false,false,Do Not Generate,false,false,false,false,true,false,false,false,Tabs,Click,false,false,false,List,"#N/A",true,"#N/A",false,"#N/A","#N/A",List,Hardware,"#N/A","#N/A","#N/A",One-time,"#N/A",false,"#N/A","#N/A","#N/A"
2c742159-913c-4a8b-a95b-012ec757e76f,"#N/A","#N/A","#N/A",Software,true,Complete Threat Solution,EP-0001,"#N/A",Default,One per quote line,"#N/A",Annual,Advance,Quantity,Recurring,false,"#N/A",Always,"#N/A","#N/A","#N/A",Required,"#N/A","#N/A","#N/A",false,"#N/A",false,"#N/A","#N/A",1.0,false,"#N/A",false,false,false,false,"#N/A",true,false,false,true,false,false,true,true,"#N/A",Click,false,false,false,List,"#N/A",true,"#N/A",false,1.0,"#N/A",List,"#N/A","#N/A",Fixed Price,1.0,Renewable,"#N/A",false,"#N/A","#N/A","#N/A"
2e0786fe-ba34-4e58-a7f8-b302da246f58,The 19-inch Black Modular Toolless Blanking Panel allows for quick and easy installation in any EIA-310-D compliant square hole mounting rail rack or enclosure.,"#N/A","#N/A",Hardware,true,Blanking Panel,BSSA-4298,"#N/A",Allow Refund,One per quote line,"#N/A","#N/A","#N/A",Quantity,One-Time,true,"#N/A","#N/A","#N/A","#N/A","#N/A",Disabled,"#N/A","#N/A","#N/A",false,"#N/A",false,"#N/A","#N/A",1.0,false,"#N/A",false,false,false,false,"#N/A",false,false,false,false,true,false,false,false,Tabs,Click,false,false,false,List,"#N/A",true,"#N/A",false,"#N/A","#N/A",List,Hardware,"#N/A","#N/A","#N/A",One-time,"#N/A",false,"#N/A","#N/A","#N/A"
2f2410ad-81a9-45c6-8c06-2cc7f09e850a,"System maintenance, administration, and configuration performed by a certified technician. Also includes 24x7 phone service and monthly on-site check-ups. 20% of hardware.","#N/A","#N/A",Services,true,Gold Hardware Maintenance,SUPP-1005,"#N/A",Default,One per quote line,"#N/A",Annual,Advance,Quantity,Recurring,true,"#N/A","#N/A","#N/A","#N/A","#N/A",Disabled,"#N/A","#N/A","#N/A",false,"#N/A",false,"#N/A","#N/A",1.0,false,"#N/A",false,false,false,false,"#N/A",false,false,false,false,false,false,true,false,Tabs,Click,false,false,false,List,"#N/A",true,"#N/A",false,"#N/A","#N/A",Net,Hardware,20.0,Percent Of Total,12.0,Renewable,"#N/A",false,"#N/A","#N/A","#N/A"
3300640e-cd73-413d-b97a-75969c92f75f,"The Program Director provides executive leadership, subject matter expertise, and program oversight.","#N/A","#N/A",Services,true,Program Director,SV-PD,"#N/A",Default,One per quote line,"#N/A","#N/A","#N/A",Quantity,One-Time,false,"#N/A","#N/A","#N/A","#N/A","#N/A","#N/A","#N/A","#N/A","#N/A",false,"#N/A",false,"#N/A","#N/A",1.0,false,"#N/A",false,false,false,false,"#N/A",false,false,false,false,false,false,true,false,"#N/A",Click,false,false,false,List,"#N/A",true,"#N/A",false,"#N/A","#N/A",List,"#N/A","#N/A","#N/A","#N/A",Renewable,"#N/A",false,"#N/A","#N/A","#N/A"
34a270b3-16e4-4c86-a412-5502c31ab79b,"Rack PDU 20A, 230V C20 input C19 output - Basic Rack Power Distribution Unit allows users to distribute power outlets to rack-mount equipment.","#N/A","#N/A",Hardware,true,"Rack PDU 20A, 230V C20 input C1",PDU-2025,"#N/A",Allow Refund,One per quote line,"#N/A","#N/A","#N/A",Quantity,One-Time,true,"#N/A","#N/A","#N/A","#N/A","#N/A",Disabled,"#N/A","#N/A","#N/A",false,"#N/A",false,"#N/A","#N/A",1.0,false,"#N/A",false,false,false,false,"#N/A",false,false,false,false,true,false,false,false,Tabs,Click,false,false,false,List,"#N/A",true,"#N/A",false,"#N/A","#N/A",List,Hardware,"#N/A","#N/A","#N/A",One-time,"#N/A",false,"#N/A","#N/A","#N/A"
356b6e72-732f-495e-bab0-a7b0d53c6416,The Power Cord is designed to provide ideal electrical connectivity to your equipments. It operates at 250-Volt voltage range.,"#N/A","#N/A",Hardware,true,C13 to C14 Power Cable 3',CMPC-5887,"#N/A",Allow Refund,One per quote line,"#N/A","#N/A","#N/A",Quantity,One-Time,true,"#N/A","#N/A","#N/A","#N/A","#N/A","#N/A","#N/A","#N/A","#N/A",false,"#N/A",false,"#N/A","#N/A",1.0,false,"#N/A",false,false,false,false,"#N/A",false,false,false,false,true,false,false,false,Tabs,Click,false,false,false,List,"#N/A",true,"#N/A",false,"#N/A","#N/A",List,Hardware,"#N/A","#N/A","#N/A",One-time,"#N/A",false,"#N/A","#N/A","#N/A"
3605cec2-bef5-44d8-aa6e-6037849d3c8e,Our certified Implementation Engineers bring a wealth of application expertise and integration experience to ensure the clients other systems are connected.,"#N/A","#N/A",Services,true,Implementation Engineer,SV-IMP,"#N/A",Default,One per quote line,"#N/A","#N/A","#N/A",Quantity,One-Time,false,"#N/A","#N/A","#N/A","#N/A","#N/A","#N/A","#N/A","#N/A","#N/A",false,"#N/A",false,"#N/A","#N/A",1.0,false,"#N/A",false,false,false,false,"#N/A",false,false,false,false,false,false,true,false,"#N/A",Click,false,false,false,List,"#N/A",true,"#N/A",false,"#N/A","#N/A",List,"#N/A","#N/A","#N/A","#N/A",Renewable,"#N/A",false,"#N/A","#N/A","#N/A"
397188c7-3c45-4f07-958f-c799f442ae04,Delivers superior performance with a theretical thoughtput of 80 Gb/s bidirectional thoughput.,"#N/A","#N/A",Hardware,true,Intel X710 Dual Port 10Gb SFP,BET X710SFP,"#N/A",Allow Refund,One per quote line,"#N/A","#N/A","#N/A",Quantity,One-Time,true,"#N/A","#N/A","#N/A","#N/A","#N/A",Disabled,"#N/A","#N/A","#N/A",false,"#N/A",false,"#N/A","#N/A",1.0,false,"#N/A",false,false,false,false,Do Not Generate,false,false,false,false,true,false,false,false,Tabs,Click,false,false,false,List,"#N/A",true,"#N/A",false,"#N/A","#N/A",List,Hardware,"#N/A","#N/A","#N/A",One-time,"#N/A",false,"#N/A","#N/A","#N/A"
