3a5a0d65-bc78-4ca5-aedc-6f341de36b0c,"Custom Implementation managed by in-house professional services, charged on a Time and Material basis.","#N/A","#N/A",Services,true,Professional Services Project,SV-PRJ,"#N/A",Default,One per quote line,"#N/A","#N/A","#N/A",Quantity,One-Time,false,"#N/A",Always,"#N/A","#N/A","#N/A",Required,"#N/A","#N/A","#N/A",false,"#N/A",false,"#N/A","#N/A",1.0,false,"#N/A",false,false,false,false,"#N/A",false,false,false,false,false,false,true,false,"#N/A",Click,false,false,false,List,"#N/A",true,"#N/A",false,"#N/A","#N/A",List,"#N/A","#N/A","#N/A","#N/A",Renewable,"#N/A",false,"#N/A","#N/A","#N/A"
3bce6d8c-a51f-4541-9aae-92ea0c41b8b7,"Security for Microsoft SharePoint ensures that your corporate SharePoint deployment does not spread malware, store inappropriate content, or lead to data loss.","#N/A","#N/A",Software,true,Security for Microsoft SharePoint,EP-011,"#N/A",Default,One per quote line,"#N/A",Monthly,Arrears,Quantity,Recurring,false,"#N/A","#N/A","#N/A","#N/A","#N/A","#N/A","#N/A","#N/A","#N/A",false,"#N/A",false,"#N/A","#N/A",1.0,false,"#N/A",false,false,false,false,"#N/A",false,false,false,false,false,false,false,false,"#N/A",Click,false,false,false,List,"#N/A",true,"#N/A",false,"#N/A","#N/A",List,"#N/A","#N/A",Fixed Price,1.0,Renewable,"#N/A",false,"#N/A","#N/A","#N/A"
3c58a71b-f715-44f3-be00-2ba190c2c48d,"Endpoint Threat Response rapidly detects, contains, investigates, and eliminates advanced threats.","#N/A","#N/A",Software,true,Endpoint Threat Response,EP-007,"#N/A",Default,One per quote line,"#N/A",Monthly,Arrears,Quantity,Recurring,false,"#N/A","#N/A","#N/A","#N/A","#N/A","#N/A","#N/A","#N/A","#N/A",false,"#N/A",false,"#N/A","#N/A",1.0,false,"#N/A",false,false,false,false,"#N/A",false,false,false,false,false,false,false,false,"#N/A",Click,false,false,false,List,"#N/A",true,"#N/A",false,"#N/A","#N/A",List,"#N/A","#N/A",Fixed Price,1.0,Renewable,"#N/A",false,"#N/A","#N/A","#N/A"
3e1e59c1-7ab6-4bfd-af86-83f17b846106,Online Single Sign On training for end users includes education and certification modules. Annual Subscription.,"#N/A","#N/A",Services,true,SSO Training Portal for End Users,S-SSO-UTP,"#N/A",Default,One per quote line,"#N/A",Annual,Advance,Quantity,Recurring,false,"#N/A","#N/A","#N/A","#N/A","#N/A","#N/A","#N/A","#N/A","#N/A",false,"#N/A",false,"#N/A",Standard,1.0,false,"#N/A",false,false,false,false,"#N/A",false,false,false,false,false,false,false,false,"#N/A",Click,false,false,false,List,"#N/A",true,"#N/A",false,"#N/A","#N/A",List,"#N/A","#N/A",Fixed Price,12.0,Renewable,"#N/A",false,"#N/A","#N/A","#N/A"
3ee54250-7c96-495e-aa22-a9d3d53e05e2,The Power Cord is designed to provide ideal electrical connectivity to your equipments. It operates at 250-Volt voltage range.,"#N/A","#N/A",Hardware,true,C19 to C20 Power Cable 3',CMPC-5889,"#N/A",Allow Refund,One per quote line,"#N/A","#N/A","#N/A",Quantity,One-Time,true,"#N/A","#N/A","#N/A","#N/A","#N/A",Disabled,"#N/A","#N/A","#N/A",false,"#N/A",false,"#N/A","#N/A",1.0,false,"#N/A",false,false,false,false,"#N/A",false,false,false,false,true,false,false,false,Tabs,Click,false,false,false,List,"#N/A",true,"#N/A",false,"#N/A","#N/A",List,Hardware,"#N/A","#N/A","#N/A",One-time,"#N/A",false,"#N/A","#N/A","#N/A"
4124a2c1-3a20-4ffe-b4b4-8e7cd6a8303e,"#N/A","#N/A","#N/A",Software,true,Endpoint Threat Defense,EP-006,"#N/A",Default,One per quote line,"#N/A",Monthly,Arrears,Quantity,Recurring,false,"#N/A","#N/A","#N/A","#N/A","#N/A","#N/A","#N/A","#N/A","#N/A",false,"#N/A",false,"#N/A","#N/A",1.0,false,"#N/A",false,false,false,false,"#N/A",false,false,false,false,false,false,false,false,"#N/A",Click,false,false,false,List,"#N/A",true,"#N/A",false,"#N/A","#N/A",List,"#N/A","#N/A",Fixed Price,1.0,Renewable,"#N/A",false,"#N/A","#N/A","#N/A"
424c6a4e-41c5-4b35-95ac-04c0ed7f4358,"Virtual Network Security Platform delivers a complete network security solution ready for the unique demands of private, public, and hybrid clouds.","#N/A","#N/A",Software,true,Virtual Network Security Platform,NS-003,"#N/A",Default,One per quote line,"#N/A",Monthly,Arrears,Quantity,Recurring,false,"#N/A","#N/A","#N/A","#N/A","#N/A","#N/A","#N/A","#N/A","#N/A",false,"#N/A",false,"#N/A","#N/A",1.0,false,"#N/A",false,false,false,false,"#N/A",false,false,false,false,false,false,false,false,"#N/A",Click,false,false,false,List,"#N/A",true,"#N/A",false,"#N/A","#N/A",List,"#N/A","#N/A",Fixed Price,1.0,Renewable,"#N/A",false,"#N/A","#N/A","#N/A"
43f15c26-24f9-4e07-b6b0-a3bab91b78e9,"Advanced Correlation Engine with Enterprise Security Manager to identify and score threat events in real time, using both rule- and risk-based logic.","#N/A","#N/A",Software,true,Advanced Correlation Engine,SIEM-001,"#N/A",Default,One per quote line,"#N/A",Monthly,Arrears,Quantity,Recurring,false,"#N/A","#N/A","#N/A","#N/A","#N/A","#N/A","#N/A","#N/A","#N/A",false,"#N/A",false,"#N/A","#N/A",1.0,false,"#N/A",false,false,false,false,"#N/A",false,false,false,false,false,false,false,false,"#N/A",Click,false,false,false,List,"#N/A",true,"#N/A",false,"#N/A","#N/A",List,"#N/A","#N/A",Fixed Price,12.0,Renewable,"#N/A",false,"#N/A","#N/A","#N/A"
46323483-c4db-4e9b-a674-bfe31dc44dd4,"Intel Xeon E5-2667 v4 3.2GHz,25M Cache,9.60GT/s 8C/16T (135W) - Designed for software defined infrastructure supercharged for efficiency, performance, and agile services delivery across cloud-native and traditional applications.","#N/A","#N/A",Hardware,true,Intel Xeon E5-2667 v4 3.2GHz,INTEL E5-2667,"#N/A",Allow Refund,One per quote line,"#N/A","#N/A","#N/A",Quantity,One-Time,true,"#N/A","#N/A","#N/A","#N/A","#N/A",Disabled,"#N/A","#N/A","#N/A",false,"#N/A",false,"#N/A","#N/A",1.0,false,"#N/A",false,false,false,false,Do Not Generate,false,false,false,false,true,false,false,false,Tabs,Click,false,false,false,List,"#N/A",true,"#N/A",false,"#N/A","#N/A",List,Hardware,"#N/A","#N/A","#N/A",One-time,"#N/A",false,"#N/A","#N/A","#N/A"
478e00c9-3497-47a4-9334-568828e8cb5d,Complete Threat Platform Solution is a comprehensive package that provides advanced defenses that investigate and contain zero-day threats and sophisticated attacks across multiple avenues.,"#N/A","#N/A",Software,false,Atomic Security Platform,EP-0001,"#N/A",Default,One per quote line,"#N/A",Annual,Advance,Quantity,Recurring,false,"#N/A",Always,"#N/A","#N/A","#N/A",Required,"#N/A","#N/A","#N/A",false,"#N/A",false,"#N/A","#N/A",1.0,false,"#N/A",false,false,false,false,"#N/A",true,false,false,false,false,false,true,true,"#N/A",Click,false,false,false,List,"#N/A",true,"#N/A",false,"#N/A","#N/A",List,"#N/A","#N/A",Fixed Price,1.0,Renewable,"#N/A",false,"#N/A","#N/A","#N/A"
48884a8e-5683-4329-9bfc-97c240e8e4ed,Online Admin Training for the Single Sign On Suite,"#N/A","#N/A",Services,true,SSO Admin Training,S-SSO-ADTR,"#N/A",Default,One per quote line,"#N/A","#N/A","#N/A",Quantity,One-Time,false,"#N/A","#N/A","#N/A","#N/A","#N/A","#N/A","#N/A","#N/A","#N/A",false,"#N/A",false,"#N/A","#N/A",1.0,false,"#N/A",false,false,false,false,"#N/A",false,false,false,false,false,false,false,false,"#N/A",Click,false,false,false,List,"#N/A",true,"#N/A",false,"#N/A","#N/A",List,"#N/A","#N/A","#N/A","#N/A",Renewable,"#N/A",false,"#N/A","#N/A","#N/A"
4a143c95-7188-4f2f-b3ee-c23fd2afcec2,Delivers superior performance with a theretical thoughtput of 80 Gb/s bidirectional thoughput.,"#N/A","#N/A",Hardware,true,Intel X710 Dual Port 10Gb Direct Attach,NET X710,"#N/A",Allow Refund,One per quote line,"#N/A","#N/A","#N/A",Quantity,One-Time,true,"#N/A","#N/A","#N/A","#N/A","#N/A",Disabled,"#N/A","#N/A","#N/A",false,"#N/A",false,"#N/A","#N/A",1.0,false,"#N/A",false,false,false,false,Do Not Generate,false,false,false,false,true,false,false,false,Tabs,Click,false,false,false,List,"#N/A",true,"#N/A",false,"#N/A","#N/A",List,Hardware,"#N/A","#N/A","#N/A",One-time,"#N/A",false,"#N/A","#N/A","#N/A"
4b621eba-0652-4446-9595-e9767438afbd,"Security Suite for Virtual Desktop Infrastructure (VDI) offers Cloud Workload Discovery for private cloud deployments, covering VMware and OpenStack, for end-to-end visibility into all workloads and their underlying platforms.","#N/A","#N/A",Software,true,Security Suite,SS-008,"#N/A",Default,One per quote line,"#N/A",Monthly,Arrears,Quantity,Recurring,false,"#N/A","#N/A","#N/A","#N/A","#N/A","#N/A","#N/A","#N/A","#N/A",false,"#N/A",false,"#N/A","#N/A",1.0,false,"#N/A",false,false,false,false,"#N/A",false,false,false,false,false,false,false,false,"#N/A",Click,false,false,false,List,"#N/A",true,"#N/A",false,"#N/A","#N/A",List,OnPremise,"#N/A",Fixed Price,1.0,"#N/A","#N/A",false,"#N/A","#N/A","#N/A"
4d362f5a-46a8-43c6-bc33-ccc2cbb734f0,Policy Auditor software automates security audit processes and helps you report consistently and accurately against internal and external policies.,"#N/A","#N/A",Software,true,Policy Auditor,SS-006,"#N/A",Default,One per quote line,"#N/A",Annual,Advance,Quantity,Recurring,false,"#N/A","#N/A","#N/A","#N/A","#N/A","#N/A","#N/A","#N/A","#N/A",false,"#N/A",false,"#N/A","#N/A",1.0,false,"#N/A",false,false,false,false,"#N/A",false,false,false,false,false,false,false,false,"#N/A",Click,false,false,false,List,"#N/A",true,"#N/A",false,"#N/A","#N/A",List,OnPremise,"#N/A",Fixed Price,12.0,"#N/A","#N/A",false,"#N/A","#N/A","#N/A"
4d54a846-b03a-4277-b8fa-559940b0904a,Windows Server Datacenter edition is designed for organizations with large workloads and heavily virtualized server environments.,"#N/A","#N/A",Software,true,Windows Server Datacenter - Onetime License,WIN SDATA-OT,"#N/A",Allow Refund,One per quote line,"#N/A","#N/A","#N/A",Quantity,One-Time,true,"#N/A","#N/A","#N/A","#N/A","#N/A",Disabled,"#N/A","#N/A","#N/A",false,"#N/A",false,"#N/A","#N/A",1.0,false,"#N/A",false,false,false,false,"#N/A",false,false,false,false,true,false,false,false,Tabs,Click,false,false,false,List,"#N/A",true,"#N/A",false,"#N/A","#N/A",List,Software,"#N/A","#N/A","#N/A",Renewable,"#N/A",false,"#N/A","#N/A","#N/A"
4eb6ca00-4769-47c7-93c2-7dab9fff7670,Windows Server 2012 R2 brings our experience delivering global-scale cloud services into your infrastructure,"#N/A","#N/A",Software,true,Windows Server R2 2012,WIN S2012,"#N/A",Allow Refund,One per quote line,"#N/A","#N/A","#N/A",Quantity,One-Time,true,"#N/A","#N/A","#N/A","#N/A","#N/A",Disabled,"#N/A","#N/A","#N/A",false,"#N/A",false,"#N/A","#N/A",1.0,false,"#N/A",false,false,false,false,"#N/A",false,false,false,false,true,false,false,false,Tabs,Click,false,false,false,List,"#N/A",true,"#N/A",false,"#N/A","#N/A",List,Software,"#N/A","#N/A","#N/A",Renewable,"#N/A",false,"#N/A","#N/A","#N/A"
4f49b3c3-628e-41df-9819-42ced8281950,Web Gateway delivers high-performance web security through an on-premises appliance that can be deployed both as dedicated hardware and a virtual machine.,"#N/A","#N/A",Software,true,Web Gateway,WS-001,"#N/A",Default,One per quote line,"#N/A",Monthly,Arrears,Quantity,Recurring,false,"#N/A","#N/A","#N/A","#N/A","#N/A","#N/A","#N/A","#N/A","#N/A",false,"#N/A",false,"#N/A","#N/A",1.0,false,"#N/A",false,false,false,false,"#N/A",false,false,false,false,false,false,false,false,"#N/A",Click,false,false,false,List,"#N/A",true,"#N/A",false,"#N/A","#N/A",List,"#N/A","#N/A",Fixed Price,1.0,Renewable,"#N/A",false,"#N/A","#N/A","#N/A"
505e4731-4a80-4b6b-a7b1-d129853a061d,"Red Hat Enterprise Linux delivers military-grade security, 99.999% uptime, support for business-critical workloads.","#N/A","#N/A",Software,true,Red Hat Enterprise Linux,REDHAT,"#N/A",Allow Refund,One per quote line,"#N/A","#N/A","#N/A",Quantity,One-Time,true,"#N/A","#N/A","#N/A","#N/A","#N/A",Disabled,"#N/A","#N/A","#N/A",false,"#N/A",false,"#N/A","#N/A",1.0,false,"#N/A",false,false,false,false,"#N/A",false,false,false,false,true,false,false,false,Tabs,Click,false,false,false,List,"#N/A",true,"#N/A",false,"#N/A","#N/A",List,Software,"#N/A","#N/A","#N/A",Renewable,"#N/A",false,"#N/A","#N/A","#N/A"
5073d56c-17fa-412c-a338-b7b98b4c9dd4,"Intel E5-2690 v4 2.6GHz,35M Cache,9.60GT/s 14C/28T (135W) - Designed for software defined infrastructure supercharged for efficiency, performance, and agile services delivery across cloud-native and traditional applications.","#N/A","#N/A",Hardware,true,Intel E5-2690 v4 2.6GHz,INTEL E5-2690,"#N/A",Allow Refund,One per quote line,"#N/A","#N/A","#N/A",Quantity,One-Time,true,"#N/A","#N/A","#N/A","#N/A","#N/A",Disabled,"#N/A","#N/A","#N/A",false,"#N/A",false,"#N/A","#N/A",1.0,false,"#N/A",false,false,false,false,Do Not Generate,false,false,false,false,false,false,false,false,Tabs,Click,false,false,false,List,"#N/A",true,"#N/A",false,"#N/A","#N/A",List,"#N/A","#N/A","#N/A","#N/A",One-time,"#N/A",false,"#N/A","#N/A","#N/A"
515719b4-14bf-474b-bbec-48f783f345f1,Network Security Platform is a next-generation intrusion prevention system (IPS) that redefines how organizations block advanced threats.,"#N/A","#N/A",Software,true,Network Security Platform,NS-002,"#N/A",Default,One per quote line,"#N/A",Monthly,Arrears,Quantity,Recurring,false,"#N/A","#N/A","#N/A","#N/A","#N/A","#N/A","#N/A","#N/A","#N/A",false,"#N/A",false,"#N/A","#N/A",1.0,false,"#N/A",false,false,false,false,"#N/A",false,false,false,false,false,false,false,false,"#N/A",Click,false,false,false,List,"#N/A",true,"#N/A",false,"#N/A","#N/A",List,"#N/A","#N/A",Fixed Price,1.0,Renewable,"#N/A",false,"#N/A","#N/A","#N/A"
5424cd6e-a0ef-40b8-841c-d055cd7b0eb8,Data Control Manager is a best in class data protection platform that includes asset management and control.,"#N/A","#N/A",Software,true,Data Control Manager,DP-004,"#N/A",Default,One per quote line,"#N/A",Monthly,Arrears,Quantity,Recurring,false,"#N/A",Always,"#N/A","#N/A","#N/A",Required,"#N/A","#N/A","#N/A",false,"#N/A",false,"#N/A","#N/A",1.0,false,"#N/A",false,false,false,false,"#N/A",false,false,false,false,false,false,false,false,"#N/A",Click,false,false,false,List,"#N/A",true,"#N/A",false,"#N/A","#N/A",List,"#N/A","#N/A",Fixed Price,1.0,Renewable,"#N/A",false,"#N/A","#N/A","#N/A"
54f5651c-beba-46e1-8d77-364ecb7d9236,"Rack PDU 30A, 120V L5-20 input 5-20 output - Basic Rack Power Distribution Unit allows users to distribute power outlets to rack-mount equipment.","#N/A","#N/A",Hardware,true,"Rack PDU 30A, 120V L5-20",PDU-2023,"#N/A",Allow Refund,One per quote line,"#N/A","#N/A","#N/A",Quantity,One-Time,true,"#N/A","#N/A","#N/A","#N/A","#N/A",Disabled,"#N/A","#N/A","#N/A",false,"#N/A",false,"#N/A","#N/A",1.0,false,"#N/A",false,false,false,false,"#N/A",false,false,false,false,true,false,false,false,Tabs,Click,false,false,false,List,"#N/A",true,"#N/A",false,"#N/A","#N/A",List,Hardware,"#N/A","#N/A","#N/A",One-time,"#N/A",false,"#N/A","#N/A","#N/A"
59135fb4-9dea-41d2-a05d-ad1cd40e9699,VirusScan Enterprise safeguards systems and files from viruses and other security risks.,"#N/A","#N/A",Software,true,VirusScan Enterprise,EP-013,"#N/A",Default,One per quote line,"#N/A",Monthly,Arrears,Quantity,Recurring,false,"#N/A","#N/A","#N/A","#N/A","#N/A","#N/A","#N/A","#N/A","#N/A",false,"#N/A",false,"#N/A","#N/A",1.0,false,"#N/A",false,false,false,false,"#N/A",false,false,false,false,false,false,false,false,"#N/A",Click,false,false,false,List,"#N/A",true,"#N/A",false,"#N/A","#N/A",List,"#N/A","#N/A",Fixed Price,1.0,Renewable,"#N/A",false,"#N/A","#N/A","#N/A"
5bad9ce8-05e4-441b-9911-1bc2c4df8c38,Installation and Assembly of a Maxspace Rack by a Infinity Solution Certified techniction,"#N/A","#N/A",Services,true,Installation and Assembly,INST-1000,"#N/A",Allow Refund,One per quote line,"#N/A","#N/A","#N/A",Quantity,One-Time,true,"#N/A","#N/A","#N/A","#N/A","#N/A",Disabled,"#N/A","#N/A","#N/A",false,"#N/A",false,"#N/A","#N/A",1.0,false,"#N/A",false,false,false,false,"#N/A",false,false,false,false,false,false,false,false,Tabs,Click,false,true,false,List,"#N/A",true,"#N/A",false,"#N/A","#N/A",List,"#N/A","#N/A","#N/A","#N/A",Renewable,"#N/A",false,"#N/A","#N/A","#N/A"
5cdcdfb0-d139-481e-856a-470fd4669763,"MaxShell cooling, power distribution, and cable management products work seamlessly with IT enclosures to provide a complete infrastructure support system.  Holds 8 rack units (U's) for a vertical storage rack.","#N/A","#N/A",Hardware,true,MaxShell 8U 600mmx1070mm,BMX-1050,"#N/A",Allow Refund,One per quote line,"#N/A","#N/A","#N/A",Quantity,One-Time,true,"#N/A","#N/A","#N/A","#N/A","#N/A",Disabled,"#N/A","#N/A","#N/A",false,"#N/A",false,"#N/A","#N/A",1.0,false,"#N/A",false,false,false,false,"#N/A",false,false,false,false,true,false,false,false,Tabs,Click,false,false,false,List,"#N/A",true,"#N/A",false,"#N/A","#N/A",List,Hardware,"#N/A","#N/A","#N/A",One-time,"#N/A",false,"#N/A","#N/A","#N/A"
5eb137fc-437a-493c-930b-6556969098f8,Single Sign On Suite,"#N/A","#N/A",Bundle,true,Single Sign On Suite,S-SSO-SAAS,"#N/A",Default,One per quote line,"#N/A",Annual,Advance,Quantity,Recurring,false,"#N/A",Always,"#N/A","#N/A","#N/A",Required,"#N/A","#N/A","#N/A",false,"#N/A",false,"#N/A","#N/A",1.0,false,"#N/A",false,false,false,false,"#N/A",false,false,true,true,false,false,true,false,Sections,Click,false,false,false,List,"#N/A",true,"#N/A",false,2.0,"#N/A",List,"#N/A","#N/A",Fixed Price,1.0,Renewable,"#N/A",false,"#N/A","#N/A","#N/A"
5f836e58-8ebb-473b-9431-6068644de489,"Endpoint Threat Protection delivers integrated anti-malware, firewall, web, email, and device control in a single solution. This includes both threat and response solutions.","#N/A","#N/A",Software,true,Endpoint Threat Protection,EP-008,"#N/A",Default,One per quote line,"#N/A",Monthly,Arrears,Quantity,Recurring,false,"#N/A","#N/A","#N/A","#N/A","#N/A","#N/A","#N/A","#N/A","#N/A",false,"#N/A",false,"#N/A","#N/A",1.0,false,"#N/A",false,false,false,false,"#N/A",false,false,false,false,false,false,false,false,"#N/A",Click,false,false,false,List,"#N/A",true,"#N/A",false,"#N/A","#N/A",List,"#N/A","#N/A",Fixed Price,1.0,Renewable,"#N/A",false,"#N/A","#N/A","#N/A"
61cb3459-301b-41c6-83df-3edfc22bd57d,"Intel Xeon E5-2660 v4 2.0GHz,35M Cache,9.60GT/s QPI,Turbo,HT,14C/28T (105W) - Designed for software defined infrastructure supercharged for efficiency, performance, and agile services delivery across cloud-native and traditional applications.","#N/A","#N/A",Hardware,true,Intel Xeon E5-2660 v4 2.0GHz,INTEL E5-2660,"#N/A",Allow Refund,One per quote line,"#N/A","#N/A","#N/A",Quantity,One-Time,true,"#N/A","#N/A","#N/A","#N/A","#N/A",Disabled,"#N/A","#N/A","#N/A",false,"#N/A",false,"#N/A","#N/A",1.0,false,"#N/A",false,false,false,false,Do Not Generate,false,false,false,false,true,false,false,false,Tabs,Click,false,false,false,List,"#N/A",true,"#N/A",false,"#N/A","#N/A",List,Hardware,"#N/A","#N/A","#N/A",One-time,"#N/A",false,"#N/A","#N/A","#N/A"
63821f8b-0e69-45d4-bc08-81fd1f489c2e,"Change Control eliminates change activity in server environments that can lead to security breaches, data loss, and outages.","#N/A","#N/A",Software,true,Change Control,SS-001,"#N/A",Default,One per quote line,"#N/A",Monthly,Advance,Quantity,Recurring,false,"#N/A","#N/A","#N/A","#N/A","#N/A","#N/A","#N/A","#N/A","#N/A",false,"#N/A",false,"#N/A","#N/A",1.0,false,"#N/A",false,false,false,false,"#N/A",false,false,false,false,false,false,false,false,"#N/A",Click,false,false,false,List,"#N/A",true,"#N/A",false,"#N/A","#N/A",List,OnPremise,"#N/A","#N/A",12.0,"#N/A","#N/A",false,"#N/A","#N/A","#N/A"
6473235c-0714-4604-b092-09493ba31237,"Support and protect your IT equipment with rack enclosures designed for flexible deployments, usability and infrastructure scalability.","#N/A","#N/A",Hardware,true,Maxspace Rack Enclosure,MAXS-1014,"#N/A",Allow Refund,One per quote line,"#N/A","#N/A","#N/A",Quantity,One-Time,false,"#N/A",Always,"#N/A","#N/A","#N/A",Required,"#N/A","#N/A","#N/A",false,"#N/A",false,"#N/A","#N/A",1.0,false,"#N/A",false,false,false,false,"#N/A",false,false,false,true,true,false,false,false,Tabs,Click,false,false,false,List,"#N/A",true,"#N/A",false,"#N/A","#N/A",List,Hardware,"#N/A","#N/A","#N/A",One-time,"#N/A",false,"#N/A","#N/A","#N/A"
657e7031-6a35-473e-89ec-f17bde1a419d,Consulting implementation package managed by in-house professional services. Rate is a blended rate with both time and materials.,"#N/A","#N/A",Services,true,Professional Services Hours (Blended Rate),SV-PSH,"#N/A",Default,One per quote line,"#N/A","#N/A","#N/A",Quantity,One-Time,false,"#N/A","#N/A","#N/A","#N/A","#N/A","#N/A","#N/A","#N/A","#N/A",false,"#N/A",false,"#N/A","#N/A",1.0,false,"#N/A",false,false,false,false,"#N/A",false,false,false,false,false,false,true,false,"#N/A",Click,false,false,false,List,"#N/A",true,"#N/A",false,"#N/A","#N/A",List,"#N/A","#N/A","#N/A","#N/A",Renewable,"#N/A",false,"#N/A","#N/A","#N/A"
660dfb0a-b1e4-4c49-9596-886071d48d38,Implementation managed by in-house professional services with an agreed upon scope of work.,"#N/A","#N/A",Services,true,Professional Services Scope of Work,SV-SOW,"#N/A",Default,One per quote line,"#N/A","#N/A","#N/A",Quantity,One-Time,false,"#N/A","#N/A","#N/A","#N/A","#N/A","#N/A","#N/A","#N/A","#N/A",false,"#N/A",false,"#N/A","#N/A",1.0,false,"#N/A",false,false,false,false,"#N/A",false,false,false,false,false,false,true,false,"#N/A",Click,false,true,false,List,"#N/A",true,"#N/A",false,"#N/A","#N/A",List,"#N/A","#N/A","#N/A","#N/A",Renewable,"#N/A",false,"#N/A","#N/A","#N/A"
6657c2f8-27a5-48b7-b4b7-da1ca849aa96,No Operating System,"#N/A","#N/A",None,true,No Operating System,CONFIG NOSW,"#N/A",Allow Refund,One per quote line,"#N/A","#N/A","#N/A",Quantity,One-Time,true,"#N/A","#N/A","#N/A","#N/A","#N/A",Disabled,"#N/A","#N/A","#N/A",false,"#N/A",false,"#N/A","#N/A",1.0,false,"#N/A",false,false,false,false,"#N/A",false,false,false,false,true,false,true,false,Tabs,Click,false,false,false,List,"#N/A",true,"#N/A",false,"#N/A","#N/A",List,Software,"#N/A","#N/A","#N/A",Renewable,"#N/A",false,"#N/A","#N/A","#N/A"
66ecf7e3-9797-45ce-8ee2-ae3507652c3e,Open Security Controller enables software-defined security by providing an abstraction layer between the security infrastructure and virtualization management of software-defined infrastructure (SDI) in the data center.,"#N/A","#N/A",Software,true,Open Security Controller,SS-005,"#N/A",Default,One per quote line,"#N/A",Monthly,Advance,Quantity,Recurring,false,"#N/A","#N/A","#N/A","#N/A","#N/A","#N/A","#N/A","#N/A","#N/A",false,"#N/A",false,"#N/A","#N/A",1.0,false,"#N/A",false,false,false,false,"#N/A",false,false,false,false,false,false,false,false,"#N/A",Click,false,false,false,List,"#N/A",true,"#N/A",false,"#N/A","#N/A",List,OnPremise,"#N/A","#N/A",12.0,"#N/A","#N/A",false,"#N/A","#N/A","#N/A"
679f51e5-f363-4aa5-8ffb-f73ddca9af5e,"Our certified Module Extension Engineers specialize in configuring and customizing the additional modules to a clients specifications, and work closely with the Core System Engineers.","#N/A","#N/A",Services,true,Module Extension Engineer,SV-MEE,"#N/A",Default,One per quote line,"#N/A","#N/A","#N/A",Quantity,One-Time,false,"#N/A","#N/A","#N/A","#N/A","#N/A","#N/A","#N/A","#N/A","#N/A",false,"#N/A",false,"#N/A","#N/A",1.0,false,"#N/A",false,false,false,false,"#N/A",false,false,false,false,false,false,true,false,"#N/A",Click,false,false,false,List,"#N/A",true,"#N/A",false,"#N/A","#N/A",List,"#N/A","#N/A","#N/A","#N/A",Renewable,"#N/A",false,"#N/A","#N/A","#N/A"
685e2f57-25c8-4ab4-86a0-44e5599d5d28,Roof Fan Tray promotes bottom to top airflow for an enclosure in zero U of space. It cools by exhausting heat out of the roof of the rack.,"#N/A","#N/A",Hardware,true,Roof Fan Tray 750mm - 120V,BSSA-4306,"#N/A",Allow Refund,One per quote line,"#N/A","#N/A","#N/A",Quantity,One-Time,true,"#N/A","#N/A","#N/A","#N/A","#N/A",Disabled,"#N/A","#N/A","#N/A",false,"#N/A",false,"#N/A","#N/A",1.0,false,"#N/A",false,false,false,false,"#N/A",false,false,false,false,true,false,false,false,Tabs,Click,false,false,false,List,"#N/A",true,"#N/A",false,"#N/A","#N/A",List,Hardware,"#N/A","#N/A","#N/A",One-time,"#N/A",false,"#N/A","#N/A","#N/A"
69d25e39-22ac-4882-9da1-4b44a47b3fab,"Enterprise Log Manager collects, compresses, signs, and stores all original events with a clear audit trail of activity that can't be repudiated.","#N/A","#N/A",Software,true,Enterprise Log Manager,SIEM-004,"#N/A",Default,One per quote line,"#N/A",Monthly,Arrears,Quantity,Recurring,false,"#N/A","#N/A","#N/A","#N/A","#N/A","#N/A","#N/A","#N/A","#N/A",false,"#N/A",false,"#N/A","#N/A",1.0,false,"#N/A",false,false,false,false,"#N/A",false,false,false,false,false,false,false,false,"#N/A",Click,false,false,false,List,"#N/A",true,"#N/A",false,"#N/A","#N/A",List,"#N/A","#N/A",Fixed Price,1.0,Renewable,"#N/A",false,"#N/A","#N/A","#N/A"
6b16e478-1af9-48bc-bb11-b52bc2c8401e,Quality Assurance Engineers test and support the activities prior to a successful Go-Live launch.,"#N/A","#N/A",Services,true,Quality Assurance Engineer,SV-QAE,"#N/A",Default,One per quote line,"#N/A","#N/A","#N/A",Quantity,One-Time,false,"#N/A","#N/A","#N/A","#N/A","#N/A","#N/A","#N/A","#N/A","#N/A",false,"#N/A",false,"#N/A","#N/A",1.0,false,"#N/A",false,false,false,false,"#N/A",false,false,false,false,false,false,true,false,"#N/A",Click,false,false,false,List,"#N/A",true,"#N/A",false,"#N/A","#N/A",List,"#N/A","#N/A","#N/A","#N/A",Renewable,"#N/A",false,"#N/A","#N/A","#N/A"
7089643e-102e-4f85-8c15-4c53f5777f92,8TB 7.2k RPM NLSAS 12Gps 3.5 in - Industry-leading rotational vibration tolerance design helps ensure consistent performance in dense multi-drive systems,"#N/A","#N/A",Hardware,true,8TB 7.2k RPM NLSAS,HD 8TB,"#N/A",Allow Refund,One per quote line,"#N/A","#N/A","#N/A",Quantity,One-Time,true,"#N/A","#N/A","#N/A","#N/A","#N/A",Disabled,"#N/A","#N/A","#N/A",false,"#N/A",false,"#N/A","#N/A",1.0,false,"#N/A",false,false,false,false,Do Not Generate,false,false,false,false,true,false,false,false,Tabs,Click,false,false,false,List,"#N/A",true,"#N/A",false,"#N/A","#N/A",List,Hardware,"#N/A","#N/A","#N/A",One-time,"#N/A",false,"#N/A","#N/A","#N/A"
